id,title,description,thumbnail_url,uploads_playlist_id,subscriber_count,last_synced_at,created_at
UCrO6kW3nA2NGZdGPkAy_bQw,Philinthecircle,"I'm Phil Hansen, a mutlimedia artist who specializes in representative portraiture using media that connect to the subject matter. I'm always pushing to experiment with new media while capturing the creation process. For more art, Philinthecircle.com

I recently started a Creativity Series PITW, showing how to engage Everyday Creativity using familiar materials and unconventional techniques. PITW aims to restore creativity through the active practice of combining and recombining ideas, breaking through the mental barriers about materials and techniques in order to move to a new mindset of rethinking categories and challenging accepted norms. For more, visit PITW.com",https://yt3.ggpht.com/ytc/AIdro_nZ6_koS8ztiG5qdAE-1CaXpUJQjSSKcOA2phKxbm0o4A=s88-c-k-c0x00ffffff-no-rj,UUrO6kW3nA2NGZdGPkAy_bQw,0,2026-06-07 01:49:25.211812+00,2026-06-07 01:49:25.211812+00
UCrRK0v-zrfe-7tAoMUfDyIA,Martana,"I like games
______________
This was a gaming channel. But since i am growing older and unable to find a corporate job, i try to revive this channel and making this as my portfolio of my skills in making videos.
i hope you liked it :)",https://yt3.ggpht.com/ytc/AIdro_mpAsaCBI3XGP9CpOixhmskTGGurDpi2S_zrciftWqvk28=s88-c-k-c0x00ffffff-no-rj,UUrRK0v-zrfe-7tAoMUfDyIA,0,2026-06-07 01:49:25.211812+00,2026-06-07 01:49:25.211812+00
UCrrlsgSJfMn7TOsf2xLuOOQ,Get The Sound,"Label / Event / Publishing
📍Paris",https://yt3.ggpht.com/DPAlKt4-NjPl_xkLxvqAU8URYQ1avnA7oUHJz5M9gpEIhKjVZFZtJcI67RBhYCtWMKsEdehTFQ=s88-c-k-c0x00ffffff-no-rj,UUrrlsgSJfMn7TOsf2xLuOOQ,0,2026-06-07 01:49:25.211812+00,2026-06-07 01:49:25.211812+00
UCRUzrULxq-sd3U5jGopiMtQ,Cypher - Dance Club BPHC,"Welcome to BPHC’s dance club - Cypher’s official YouTube channel! Whether you're a dance enthusiast or just curious about what we do, our channel offers a glimpse into the energy and creativity that define our club.

We post our inauguration performances, competition performances, and flashmobs here. Hope you enjoy watching them :) 

Join us in our Cultural fest - Pearl, where we have group and solo dance competitions where you can win amazing cash prizes! 
Follow our Instagram page for more details : cypher_bphc",https://yt3.ggpht.com/xfdSrkDcMcWYsH9i7FjOn33mgaUTgH0lpcODHjmWWUzFfUnJ7wK0xJRCYtkXAiUHV7Owy206=s88-c-k-c0x00ffffff-no-rj,UURUzrULxq-sd3U5jGopiMtQ,0,2026-06-07 01:49:25.211812+00,2026-06-07 01:49:25.211812+00
UCRy5sxR9z4wqC5rwvARJVNg,Stanford AI Club,Stanford's premier student-let club focused on AI research and development.,https://yt3.ggpht.com/txAwsM_qNfdFaRhH0HVWWYKqQumgA0DPzEm1-_yeChVvfnCLs3LbWRyAl3C-xuW8a1k9hjN5=s88-c-k-c0x00ffffff-no-rj,UURy5sxR9z4wqC5rwvARJVNg,0,2026-06-07 01:49:25.211812+00,2026-06-07 01:49:25.211812+00
UCs-J2JVrQnK38C0ZbPWqV4A,Genius Educations,Hello!!!,https://yt3.ggpht.com/_9Je_G-dDBwjGO6uGrV7GinczmyCaoydLOzDcCp11h5x1wl8gnfBB7YCh8KoVDtAyCWHORLK=s88-c-k-c0x00ffffff-no-rj,UUs-J2JVrQnK38C0ZbPWqV4A,0,2026-06-07 01:49:25.211812+00,2026-06-07 01:49:25.211812+00
UCs14Smim-bliHN4GBEom-Vg,Barron Cruz | Status Signals,"Most men have social blind spots that hurt their careers, relationships, and reputation. Everyone sees them, but no one will ever tell them.

Some guys walk into a room and get immediate respect. Others say the perfect thing and get ignored.

The difference is what you're signaling. 

Signals your nervous system transmits automatically that people evolved to read before language.

We break them down frame by frame so you can see what most people miss.",https://yt3.ggpht.com/Oaxzhc_BHut7VyngUjLbS6rsevMvfvgwB8BWkpsIOPEmGdz-fqt1jESa7OG7zMvvDijRwnOGCg=s88-c-k-c0x00ffffff-no-rj,UUs14Smim-bliHN4GBEom-Vg,0,2026-06-07 01:49:25.211812+00,2026-06-07 01:49:25.211812+00
UCS4oJeUrEtPcTqF9NiZsUjQ,Amrutha Productions,"Welcome to the official YouTube channel of Amrutha Productions. The Production Company for the movies ""HRUDAYA KALEYAM"" & ""KOBBARIMATTA""",https://yt3.ggpht.com/ytc/AIdro_niP3BkwJIdH8-94H4B_-CySqw31Zun7yc-1HGLoeRaEbs=s88-c-k-c0x00ffffff-no-rj,UUS4oJeUrEtPcTqF9NiZsUjQ,0,2026-06-07 01:49:25.211812+00,2026-06-07 01:49:25.211812+00
UCsDAemirN7qaUriaXzsFaHA,Infinitum Cine Masti,"A single stop for all your boredom problems. Come watch Infinitum’s best mashups of all  your favourites and don’t forget to get your popcorn bucket 😬

For Brands Collaboration mail us at brands@infinitumnetwork.in",https://yt3.ggpht.com/H2-IH2lUBlHrpom27-uicHq2GpR1kWxIRMaMt5cNy9dhzaPUPlO-0aLmniDt3Wxl6CE1X64UZw=s88-c-k-c0x00ffffff-no-rj,UUsDAemirN7qaUriaXzsFaHA,0,2026-06-07 01:49:25.211812+00,2026-06-07 01:49:25.211812+00
UCShHFwKyhcDo3g7hr4f1R8A,World Science Festival,"Watch long and short-form videos on nearly every science-related topic including physics, biology, the brain, robotics, medicine, space, engineering, and the Earth. We gather great minds in science and the arts to produce live and digital content that allows a broad general audience to engage with scientific discoveries. Through discussions, debates, original films, lectures, and intimate salons, the World Science Festival takes science out of the laboratory and out into world. 

The World Science Festival is a production of the World Science Foundation, a 501c3 non-profit headquartered in New York City.  Our mission is to cultivate a general public informed by science, inspired by its wonder, convinced of its value, and prepared to engage with its implications for the future.",https://yt3.ggpht.com/ytc/AIdro_kNH8NsEj5xYBosTXOXjr9fkqkOILQeRp8K5wV78Ez6GJI=s88-c-k-c0x00ffffff-no-rj,UUShHFwKyhcDo3g7hr4f1R8A,0,2026-06-07 01:49:25.211812+00,2026-06-07 01:49:25.211812+00
UCSqkS8oSsiaVY7wyUXJhgYw,SosinIAS Academy,"Official YouTube Channel of India’s Renowned Faculty, Mrs. Sosin Thayyaba Revella. 

""SosinIAS Academy"" Is The Best Institute for Coaching in UPSC Civil Services Examination, State Public Service Commissions, and Other Competitive Exams! We have an expert team teaching all subjects under General Studies, along with the Anthropology Optional. For more information, please call +91- 90000 36699 / 99899 66744, leave a mail to info@sosinias.com, or visit www.sosinias.com",https://yt3.ggpht.com/cnThmgSTYnLbgDcx4C3l6sXN-l3VtRJSdEMOfd3NdZVSDoBy0FhsYuQPRpXe3BnD0UXP8IhT6w=s88-c-k-c0x00ffffff-no-rj,UUSqkS8oSsiaVY7wyUXJhgYw,0,2026-06-07 01:49:25.211812+00,2026-06-07 01:49:25.211812+00
UCstvxxxdPlyIGUg6R6a0psw,learnfluidmechanics,"This is an undergraduate level Fluid Mechanics course, which was given to the 2nd year Engineering Students at Cambridge University Engineering Department from 2005 to 2013 by Dr. Matthew Juniper.

www.learnfluidmechanics.org",https://yt3.ggpht.com/ytc/AIdro_moUZfNQEU19krw4FyEGXTp0QjydgApTy-qUIHicfu-Ng=s88-c-k-c0x00ffffff-no-rj,UUstvxxxdPlyIGUg6R6a0psw,0,2026-06-07 01:49:25.211812+00,2026-06-07 01:49:25.211812+00
UCSXkZSW4yHU00tdzlYGWApg,Copenhagen ZOO,"I Zoologisk Have København kan du møde mere end 4000 fascinerende dyr og krydse kontinenter i en trækvogn. Kom helt tæt på de ikoniske pandaer og spis synkront med de bambusspisende bjørne i det storslåede Pandaanlæg. Kom så tæt på isbjørnene, at du får kuldegysninger og se verden fra oven som en giraf. Fyld hjernen med overraskende viden og maven med sunde måltider. ZOO er fyldt med opdagelser hver dag 365 dage om året. Alverdens opdagelser venter.              

In Copenhagen ZOO, you can meet more than 4,000 fascinating animals and travel between continents in just one day. Visit the iconic pandas in the state of the art Panda Facility and experience unforgettable close encounters with polar bears. A world to explore awaits.

Hjemmeside / webpage:
www.zoo.dk

Social media:
facebook.com/zoo
Instagram: copenhagenzoo",https://yt3.ggpht.com/ytc/AIdro_ktmEhsg5hcK09k4xoKmKzUJiIYSvHbu_3gJok0bzQjuNA=s88-c-k-c0x00ffffff-no-rj,UUSXkZSW4yHU00tdzlYGWApg,0,2026-06-07 01:49:25.211812+00,2026-06-07 01:49:25.211812+00
UCsXVk37bltHxD1rDPwtNM8Q,Kurzgesagt – In a Nutshell,"Animation videos explaining things with optimistic nihilism since 12,013.

We’re a team of illustrators, animators, number crunchers and one dog who aim to spark curiosity about science and the world we live in. To us nothing is boring if you tell a good story.

For updates on our videos and other news from the kurzgesagt universe follow us on Twitter, Facebook, Instagram and LinkedIn.",https://yt3.ggpht.com/ytc/AIdro_n1Ribd7LwdP_qKtqWL3ZDfIgv9M1d6g78VwpHGXVR2Ir4=s88-c-k-c0x00ffffff-no-rj,UUsXVk37bltHxD1rDPwtNM8Q,0,2026-06-07 01:49:25.211812+00,2026-06-07 01:49:25.211812+00
UCt-WqkTyKK1_70U4bb4k4lQ,TomoNews US,"TomoNews is your best source for real news. We cover the funniest, craziest and most talked-about stories on the internet. Our tone is irreverent and unapologetic. If you’re laughing, we’re laughing. If you’re outraged, we’re outraged. We tell it like it is. And because we can animate stories, TomoNews brings you news like you’ve never seen before.",https://yt3.ggpht.com/ytc/AIdro_n_20KlqBhurQM8MkPt6s3J8Alkt8piUgXgQIwjSirlZiw=s88-c-k-c0x00ffffff-no-rj,UUt-WqkTyKK1_70U4bb4k4lQ,0,2026-06-07 01:49:25.211812+00,2026-06-07 01:49:25.211812+00
UCTcBhAB55irgVf4c6ASN6nw,PLE at Lund University,"The Department of Process and Life Science Engineering (PLE) was formed 2024-01-01 by a merger of the Department of Chemical Engineering and the Department of Food Technology, Engineeering and Nutrition.  

On this channel we gather podcasts/videos that our students can benefit from in our courses, but also some videos about our research. Some podcast/videos are in Swedish

Här samlar vi främst podcasts/videos som våra studenter har nytta av i kurserna, men även några videos om vår forskning. En del podcasts/videos är på engelska. På svenska heter vi Institutionen för processteknik och tillämpad biovetenskap och finns på Lunds Tekniska Högskola (LTH) vid Lunds universitet. Kanalnamnet var tidigare ""ChemengLU"" och dessförinnan ""Kemiteknik LTH""",https://yt3.ggpht.com/vROvD676B2fz7MV-foK8OQ6SOr0iu0yj9L2iscGN_-LyTpIOLOzX_RXla0qjtnJYxt7HM54C=s88-c-k-c0x00ffffff-no-rj,UUTcBhAB55irgVf4c6ASN6nw,0,2026-06-07 01:49:25.211812+00,2026-06-07 01:49:25.211812+00
UCtESv1e7ntJaLJYKIO1FoYw,Periodic Videos,"Your ultimate channel for all things chemistry. A video about each element on the periodic table. And we upload new videos every week about science news, interesting molecules and other stuff from the world of chemistry.",https://yt3.ggpht.com/ytc/AIdro_mVnp1Lc31B0TPILH30sz-eIQqX9ZML3ORtONYjcoNiQP4=s88-c-k-c0x00ffffff-no-rj,UUtESv1e7ntJaLJYKIO1FoYw,0,2026-06-07 01:49:25.211812+00,2026-06-07 01:49:25.211812+00
UCtiPxFWKtzixXdvPI9sspew,Myrtle Beach Safari,"Feed an elephant, interact with a variety of cubs, watch an eagle soar, monkey around with great apes, and meet the Liger, the world's biggest cat! Located of 50 acres of tropical paradise, this unforgettable, once-in-a-lifetime experience can only be had at the Myrtle Beach Safari
Book a Tour at Myrtle Beach Safari Now!",https://yt3.ggpht.com/ytc/AIdro_lUQxkigeMt-jmFUkq1irzH0KQDdSQdrSLw5KfSrsuHO_g=s88-c-k-c0x00ffffff-no-rj,UUtiPxFWKtzixXdvPI9sspew,0,2026-06-07 01:49:25.211812+00,2026-06-07 01:49:25.211812+00
UCtKVjrV_DiHQrqvWAVwt-zA,bear or panda,"Our Channel is Unlimited Treasure of Laughter 😍 🤩 Welcome To bear or panda Family 🤗🤗

Friends Hope You All Are Well ☺️☺️ Your Support Means A Lot 🙏 ❤️ 

Come With Me In A Beautiful Cartoon World Of Bubu Dudu.....Please  To OurChannel To Always Be Happy 😊 





For sponsorship and business 
enquiries : bablibiswas055@gmail.com",https://yt3.ggpht.com/jTrDzUvLp-oawvTO2nIvvjic4UzM6QHP_Pnxx1o5aMiWqdjEWpO2G58f90dkjYBr_Q3mPUmPKA=s88-c-k-c0x00ffffff-no-rj,UUtKVjrV_DiHQrqvWAVwt-zA,0,2026-06-07 01:49:25.211812+00,2026-06-07 01:49:25.211812+00
UCTl3QQTvqHFjurroKxexy2Q,Olympics,"Welcome to the Olympics YouTube channel, where the Games never end! 🥇

From the best musical moments at the Olympic Games in our Music Monday series to weekly compilation videos with highlights from the Olympics on Fridays, plus exclusive documentaries about the stories behind the glory, this is where you can find everything about the biggest sporting event in the world.",https://yt3.ggpht.com/ytc/AIdro_mgqNPYKqnE7FG3Pk1zbi0hpKihVPbWSk-Rfsbr0ki0bFPK=s88-c-k-c0x00ffffff-no-rj,UUTl3QQTvqHFjurroKxexy2Q,0,2026-06-07 01:49:25.211812+00,2026-06-07 01:49:25.211812+00
UCtlGFQH6iDuszGgfAyr5Mow,Extreme Trends,Heartwarming and Inspirational Stories!,https://yt3.ggpht.com/ytc/AIdro_mACXZVQYQbMbwYU0263rHK40W0JSDFehBs4xs7P30ynzI=s88-c-k-c0x00ffffff-no-rj,UUtlGFQH6iDuszGgfAyr5Mow,0,2026-06-07 01:49:25.211812+00,2026-06-07 01:49:25.211812+00
UCtoU7cQPzDlK-RifwrMEllA,THE HINDU SAGA,"Are you into stories, mythology, vedic literature and interesting facts of Hinduism? Then say no more.... THE HINDU SAGA is here for you!

 to our channel as we bring you something new every week :)

For enquiries - aapkigoodlife@gmail.com

Disclaimer: 
1. All information, stories and everything shared on the videos of THE HINDU SAGA channel is based on information collected from various sources like books, newspapers and internet. While we try our best to produce good content that seems authentic to our knowledge, THE HINDU SAGA does not create or claim authenticity of any of the information provided in this channel. 
2. Any resemblance to real persons, living or dead is unintentional and purely coincidental. 
3. We do not intend to hurt any religious sentiments of our viewers. 
4. Some parts from this video like music, pictures and videos etc. are sourced from the web. The Hindu Saga does not declare any ownership and is ready to give the rights to whoever it is due.",https://yt3.ggpht.com/ytc/AIdro_nJCPSOoGibZjPTTzK2yeFAB_l8zP3a3Z7ff5RBW3MOGdo=s88-c-k-c0x00ffffff-no-rj,UUtoU7cQPzDlK-RifwrMEllA,0,2026-06-07 01:49:25.211812+00,2026-06-07 01:49:25.211812+00
UCtwortTH9QnY2V31EJwbuFQ,Leonard Dixon,,https://yt3.ggpht.com/ytc/AIdro_nOnvNPd5SMfB-raiOwATA_Z-Qs66AFpzcN3lgR0k5SNfTo=s88-c-k-c0x00ffffff-no-rj,UUtwortTH9QnY2V31EJwbuFQ,0,2026-06-07 01:49:25.211812+00,2026-06-07 01:49:25.211812+00
UCu4X846OSea5YU6S8fIpy1A,BigDawsTv,"We want to make you smile. Enjoy pranks, interactions with strangers and giving back videos that will brighten your day 😃",https://yt3.ggpht.com/gHElZa1GJlENKz1-T2-Raq7U2BOcdqFsE4xXKK7KG3hPXlJ9cNYCXhPoIDlKrSpcShXo2KKf=s88-c-k-c0x00ffffff-no-rj,UUu4X846OSea5YU6S8fIpy1A,0,2026-06-07 01:49:25.211812+00,2026-06-07 01:49:25.211812+00
UCU5K3Gy7UL-iBnH_mbRz4kA,Unfiltered Opinions,"Welcome to Unfiltered Opinions, an initiative by Unacademy.

Get all your questions answered by the best of best!
Whether you are looking to know more about the exams or the life and journey of those who aced the exams, we have got you covered.
The channel presents your favorite Toppers and Top Educators in a candid and unscripted segment sharing their opinions on some of the most asked questions.

Do you have a question that you would want an Unfiltered Opinion on?
Shoot us an email at unfilteredopinions@unacademy.com",https://yt3.ggpht.com/ytc/AIdro_kayBcQcWLX5Xy8Wj5TFwHp5S89oAixc0M3OZi4c8551A=s88-c-k-c0x00ffffff-no-rj,UUU5K3Gy7UL-iBnH_mbRz4kA,0,2026-06-07 01:49:25.211812+00,2026-06-07 01:49:25.211812+00
UCu6mSoMNzHQiBIOCkHUa2Aw,Cody'sLab,"Aright everyone Cody here!
Welcome to my channel! I hope you enjoy watching!",https://yt3.ggpht.com/ytc/AIdro_nkRbbxWLqS_5HspvSZjXyix-h2JAhiuf-aLqWomFYw32s=s88-c-k-c0x00ffffff-no-rj,UUu6mSoMNzHQiBIOCkHUa2Aw,0,2026-06-07 01:49:25.211812+00,2026-06-07 01:49:25.211812+00
UCuAHfJyWROB4XRReS43EWUw,The Bucket List Family,"Hello world! We decided to sell everything and leave home for an adventure around the world. Now, we work full-time as Family Travel Journalists! Thank you for being a part of this amazing journey! 


Facebook: The Bucket List Family
Instagram: thebucketlistfamily",https://yt3.ggpht.com/ytc/AIdro_k9YgMKfJOUfL8RlPF-OYNmwZdoIq3Zbtj24Upbz9PrvFA=s88-c-k-c0x00ffffff-no-rj,UUuAHfJyWROB4XRReS43EWUw,0,2026-06-07 01:49:25.211812+00,2026-06-07 01:49:25.211812+00
UCufrLThp1VAAhpBF04yLIfA,Bubu Dudu & Gomu Peachu Love Story,"bubu dudu and Gomu peachu love story is dedicated to make entertaining and value oriented videos for you.
We create unique life stories of cute couple peach goma AKA bubu and dudu or Peachu Gomu, this Gomu Peachu Love Story is the channel  for  their love story. 
The love of people toward this lovely couple gave them many names, some of them are panda bear, sugar brownie and milk mocha bear as well. 

ham gomu aur peachu ya bubu aur dudu ki kahaniya banate hain, dekhiye aur maje kijiye. dudu aur bubu ki kahani, goma peach, bear aur panda",https://yt3.ggpht.com/joK_9Zj1sRdsWNuGTGIMi4RSBDueFF_qY0V6UwP3bnHLZ5-LmJWCHYDxP23m6c_zrvf18-Sn=s88-c-k-c0x00ffffff-no-rj,UUufrLThp1VAAhpBF04yLIfA,0,2026-06-07 01:49:25.211812+00,2026-06-07 01:49:25.211812+00
UCUHW94eEFW7hkUMVaZz4eDg,minutephysics,"Simply put: cool physics and other sweet science.

""If you can't explain it simply, you don't understand it well enough.""
~Rutherford via Einstein? (wikiquote)

Created by Henry Reich",https://yt3.ggpht.com/ytc/AIdro_mNlRy8Ablr-4VtAT6eDe7ED-3tfNFZ0FwhEYdtc6B_oQ=s88-c-k-c0x00ffffff-no-rj,UUUHW94eEFW7hkUMVaZz4eDg,0,2026-06-07 01:49:25.211812+00,2026-06-07 01:49:25.211812+00
UCV3AkAsIDQjNQJHQgYwXjQA,Pathfinder by Unacademy,"Welcome to Pathfinder by Unacademy, your ultimate hub for UPSC CSE success
Embark on your journey with our unwavering support, providing invaluable resources, guidance, and essential strategies for UPSC CSE excellence. Guided by Mr. Shubhendra Chouhan and Mr. Anirudh Aggarwal along with your dedicated efforts, success is within reach

Unacademy Centre Mukherjee Nagar : 
Unacademy Centre Prayagraj: 
Unacademy Centre Karol Bagh: 
For info, fill the form, we will connect: 
Join Telegram for Updates, Free Resources: 

 for a wealth of guidance, and tips. Let's expertly navigate the intricate path of UPSC CSE preparation together!",https://yt3.ggpht.com/aBb8S0AAWGwHfDg1YHJO72MN7TVrdlMdg8xAdmvuXS1n5JODdSm__qdGP1cdaILPOUo74PpJDxk=s88-c-k-c0x00ffffff-no-rj,UUV3AkAsIDQjNQJHQgYwXjQA,0,2026-06-07 01:49:25.211812+00,2026-06-07 01:49:25.211812+00
UCV5WPVIeMk7CJUJNkCRNUdQ,Originalos,"ORIGINALOS
 An extremely funny dialogue-free stone-age animated comedy for whole the family.
Each episode takes off with the invention of a specific object or idea that we use in our everyday life. At the time it was invented it must have been a milestone along the bumpy road of development. Like the invention of the football, fire, wheel, fitness, love, flushing toilets and much more.

We watch some of the difficulties the inventors may have met before the right idea appeared, with hilarious results!. We see one or two of the wrong turns that a good invention could have taken. The episodes are set a number of years before the invention was perfected. E.g. the wheel has not quite found the right shape yet and some of the Originalos people can not see any use for the soup plate.

They may not all be scientifically proven facts but ORIGINALOS? will give you a great laugh, and maybe an idea or two!

Originalos is created and produced by us, Tiny Film ApS in Denmark",https://yt3.ggpht.com/yzaSGtPFHbvKNrYjI2zCVeuGiDDLe1k-icYJOj23T3489vpeJE9FXCcEhLm38OxmHNb_iQVqyA=s88-c-k-c0x00ffffff-no-rj,UUV5WPVIeMk7CJUJNkCRNUdQ,0,2026-06-07 01:49:25.211812+00,2026-06-07 01:49:25.211812+00
UCV6HJBZD_hZcIX9JVJ3dCXQ,WildEarth,"Our LIVE SAFARIS with expert guides give you an intimate African safari experience from various gorgeous locations - animals, landscapes, action, peace, wild connection - unscripted, authentic and real. 

Come and see us in Africa at our broadcast locations or any other safari hotspot - check out wildearth.travel

Watch here on YouTube or: 
DStv (Channel 183)
Freeview (Channel 91) 
Roku (Channel 478) 
Samsung TV Plus USA (Channel 3533) 

You can also watch our waterhole camera at Jaci's Safari House in the world-famous Sabi Sand Nature Reserve

Join our YouTube membership programme for an ad free experience with added perks and be part of our mission to connect people with nature.

Invite nature to be part of your daily routine. Wilderness heals!",https://yt3.ggpht.com/zb-6Z5GhUv-wAMcZy7Zb9GX2Gk64bpRSkT0ja8buO77MUXTfEn5csigISOuzhDq5UWUDdopJ_A=s88-c-k-c0x00ffffff-no-rj,UUV6HJBZD_hZcIX9JVJ3dCXQ,0,2026-06-07 01:49:25.211812+00,2026-06-07 01:49:25.211812+00
UCVaQOn6bNwDTwWTbEbxt3Zw,KchessK,"If you play chess online and your game is just too good to be ignored, I will be watching. You can count on it.
Greetings from the great city of Houston
Thank you for watching and subscribing to my chess channel.

Skaak, shah, شطرنج, շախմատ, şahmat, Xake, шахматы, шах, escacs, 棋, 棋, šah, šachy, skak, schaakspel, ahedres, shakki, échecs, ჭადრაკი, Schach, σκάκι, Echèk, שחמט, शतरंज, sakk, skák, catur, ficheall, scacchi, チェス, 체스, latrunculorum, šahs, šachmatai, шатрын, sjakk, شطرنج, xadrez, șah, шах, шахматы, šah, 
ajedrez, schack, satranç, Шахи, cờ vua,",https://yt3.ggpht.com/ytc/AIdro_kAEQLGDVFmGoJGgTWRtvSJV4bzSt92c4gLpjMbktaU8iY=s88-c-k-c0x00ffffff-no-rj,UUVaQOn6bNwDTwWTbEbxt3Zw,0,2026-06-07 01:49:25.211812+00,2026-06-07 01:49:25.211812+00
UCVB5Yst0Dh1yLhJV6RBsBKQ,BEST TWINSIES FOREVER,Best kids,https://yt3.ggpht.com/ytc/AIdro_nCIeHeoPBxR4GtCGujpU8x9fzmpSoGBm43VvOdt6QrCg=s88-c-k-c0x00ffffff-no-rj,UUVB5Yst0Dh1yLhJV6RBsBKQ,0,2026-06-07 01:49:25.211812+00,2026-06-07 01:49:25.211812+00
UCvBqzzvUBLCs8Y7Axb-jZew,Sixty Symbols,Cool videos about physics and astronomy.,https://yt3.ggpht.com/ytc/AIdro_kyM48qMw5ziZF_z3StRQsXB_320rIKeU4cjxLZPVxsUw=s88-c-k-c0x00ffffff-no-rj,UUvBqzzvUBLCs8Y7Axb-jZew,0,2026-06-07 01:49:25.211812+00,2026-06-07 01:49:25.211812+00
UCVCxJEyGbWYbEN9j5SevGuA,The Memphis Hub,"We aim to be the main creatives to highlight Memphis,TN and shine a light on the actual community and good that Memphis can bring.",https://yt3.ggpht.com/yMXYVJLfw2dQMZdt2hfo-lVoJl7rR4i6cHyGecW4A-rQCX0X8L0p6qPFOZngtSqAFoX4hlNvSA=s88-c-k-c0x00ffffff-no-rj,UUVCxJEyGbWYbEN9j5SevGuA,0,2026-06-07 01:49:25.211812+00,2026-06-07 01:49:25.211812+00
UCvlkMq7QfHFK5VJZa0aeMeQ,Rowan Atkinson Live,"Selected Highlights from Rowan's stand up tours during the years 1981 to 1986.

Whether mesmerising us with the sheer visual mastery of Mr. Bean, beguiling us with the acerbic wit of Edmund Blackadder, or simply entertaining us as the suave, but rather hapless British Secret Agent Johnny English, you surely won't have escaped the comic genius that is Rowan Atkinson.

In Rowan Atkinson Live, co-written with Richard Curtis (4 Weddings & a Funeral, Notting Hill, Love Actually) and Ben Elton, Atkinson runs the whole gamut of his remarkably versatile 30 year career, with sketches, mimes and monologue's that are guaranteed to have you shedding tears of laughter. Performing live on stage alongside ""straight man"" Angus Deayton, the show features a number of original and familiar routines, including sketches that appeared in the original Mr. Bean series.",https://yt3.ggpht.com/ytc/AIdro_k0cN0E8aPR2iupcQ2WqiALOLUBjLps8NGkgzj2px2Xyw=s88-c-k-c0x00ffffff-no-rj,UUvlkMq7QfHFK5VJZa0aeMeQ,0,2026-06-07 01:49:25.211812+00,2026-06-07 01:49:25.211812+00
UCvPBwFtlth679NMXM2jsxlg,NeoScribe,"We live in an incredible time of rapid innovation and discovery. 
This channel will take you on journeys to explore what makes the universe amazing. 
We will look to the past to understand the present, and we will look to the discoveries of the present to uncover the future that awaits us. 
This channel strives to offer more than just presenting facts and regurgitating the news.
This channel aims to explore artistic proof in the world around us. 
Above all, NeoScribe main mission is to bring you the incredible. 
 
Mailing address: 
PO Box 232
Enola, PA 17025",https://yt3.ggpht.com/ytc/AIdro_mJEPREccMi5ZbjUt8MmKZ10uCDO9gATr79OBTjoh0zWy0=s88-c-k-c0x00ffffff-no-rj,UUvPBwFtlth679NMXM2jsxlg,0,2026-06-07 01:49:25.211812+00,2026-06-07 01:49:25.211812+00
UCvy9bjqfawiaE_CklFSdnzg,abcqanda,"Q+A is the ABC TV program which puts punters, pollies and pundits together in the studio to thrash out the hot issues of the week. 

Follow us on Twitter: @QandA or like us on Facebook: 

If you’re in Australia, check out  for more great shows from ABC TV.",https://yt3.ggpht.com/6v-7_MQWDJZ7a5KBUHxJcIiH-YTwgFqZv1tbmCTnceEaBdzyOuvhCBj7yfOprGb8THBKMrtiZDs=s88-c-k-c0x00ffffff-no-rj,UUvy9bjqfawiaE_CklFSdnzg,0,2026-06-07 01:49:25.211812+00,2026-06-07 01:49:25.211812+00
UCW-5slIpDNuANRzZEVcSnEg,vdublu909,"I created this channel to share my instrumental covers. It's all just for fun, I have a passion for music, especially 80's synth pop, new wave etc. Enjoy!",https://yt3.ggpht.com/KYmguIc2XXznjqqOY_XufTk3JV5iBslMEK-3RIPqcdjSOsu5Jr8nGzHfpAXmNWs96fFgqgZxAOs=s88-c-k-c0x00ffffff-no-rj,UUW-5slIpDNuANRzZEVcSnEg,0,2026-06-07 01:49:25.211812+00,2026-06-07 01:49:25.211812+00
