id,title,description,thumbnail_url,uploads_playlist_id,subscriber_count,last_synced_at,created_at
UC_aEa8K-EOJ3D6gOs7HcyNg,NoCopyrightSounds,"NCS is on a mission to soundtrack the internet. 🚀

For over a decade, NCS has been home to some of the most iconic tracks in online culture—from YouTube intros to viral TikTok moments. We work with artists from around the world, covering everything from House and Drum & Bass to Dubstep, Phonk, Pop, and beyond.

We’re still copyright free and stream safe for creators. NCS music is free to use for independent creators and their UGC (User Generated Content) on YouTube & Twitch—just remember to credit the artist, track, and NCS, and link back to our original upload.

🔗 View our full usage policy & FAQs here:",https://yt3.ggpht.com/opGwWu2ScRBy-OA81LIzKwSatxlVKjjNyAdt4fWh4LoLzldx05Sdf3OGQz0Fz78ziZ9RLP4=s88-c-k-c0x00ffffff-no-rj,UU_aEa8K-EOJ3D6gOs7HcyNg,0,2026-06-07 01:49:25.211812+00,2026-06-07 01:49:25.211812+00
UC_fTEARmdukYGelQ6uPoWhw,Shiva Singh,"Hello and welcome you all to an educational channel where I,Shiva(HPCL,GATE 2017-181 AIR) will be helping chemical engineering students preparing for GATE 2020 to learn from scratch developing basic concepts with video lectures related to GATE chemical engineering syllabus,timely motivation and helping them with their PSU and core chemical engineering company interviews also.",https://yt3.ggpht.com/ytc/AIdro_nKNgWTREjzAzW0L4cWlSjZumBDm2_ZF52P6n6zYP_p6m0=s88-c-k-c0x00ffffff-no-rj,UU_fTEARmdukYGelQ6uPoWhw,0,2026-06-07 01:49:25.211812+00,2026-06-07 01:49:25.211812+00
UC_g2RbNMcraoOPc-vYJjgIA,Data Science Gems,"These are recordings of the latest pieces of breakthrough research on deep learning for NLP and vision. The goal is to put up at least one update per week.

HomePage: 
LinkedIn: 

Manish Gupta is a Principal Applied Researcher at Microsoft India R&D Private Limited at Hyderabad, India. He is also an Adjunct Faculty at IIIT, Hyderabad and a visiting faculty at ISB, Hyderabad. He received his Masters in Computer Science from IIT Bombay (2007) and Ph.D. from the Univ of Illinois at Urbana-Champaign in 2013. He worked for Yahoo! Bangalore from 2005-07. His research interests are in the areas of deep learning, natural language processing, web mining and data mining. He has published 150+ research papers in reputed refereed journals and conferences. He has also co-authored two books: one on Outlier Detection for Temporal Data and another one on Information Retrieval with Verbose Queries.",https://yt3.ggpht.com/LYpaJSUhIIimsymTpDqwXP9dYNzb-dyKodHkLjm2nw-XSyMdVPsn756s4f6XkoUn9cKsOZMbhi4=s88-c-k-c0x00ffffff-no-rj,UU_g2RbNMcraoOPc-vYJjgIA,0,2026-06-07 01:49:25.211812+00,2026-06-07 01:49:25.211812+00
UC_NS4MiiHAFo3CYI7fRSLtQ,The Lion Whisperer,"Welcome to Kevin Richardson's Official YouTube channel, The Lion Whisperer. 

This channel aims to raise awareness about The Kevin Richardson Wildlife Sanctuary and its mission to provide a self-sustaining African carnivore sanctuary for the purposes of wild species preservation, education, awareness and funding.

Upload Schedule: 
New Video uploaded every Friday at 4:00 PM GMT 
New Members Video uploaded bi-weekly on Mondays at 4:00 PM GMT

Become a member of The Lion Whisperer today and receive exclusive videos and content!",https://yt3.ggpht.com/UDE_Mm8u_DJllAKbfwFglRxgWZ5iXIag-F722qIW3-fWFp9BKpZEHbiXmRXzSNNJdFmkltYVPHI=s88-c-k-c0x00ffffff-no-rj,UU_NS4MiiHAFo3CYI7fRSLtQ,0,2026-06-07 01:49:25.211812+00,2026-06-07 01:49:25.211812+00
UC_r-3nRot7wM0IrCJZ3LW2g,Global Ethics Solutions,"Welcome to the Global Ethics Solutions Youtube channel! Here you will find samples, training modules, and video clips that will encourage your employees and share the latest in business ethics content. Our business ethics training videos in both English and Spanish provide helpful tips and information to build integrity in your organization. If your organization does not have ethics training programs or ethics reporting systems, let Global Ethics Solutions help your organization build a world-class program. Contact us for free demos of our courses and compliance reporting software.",https://yt3.ggpht.com/Oq3jnS5dsVS5pZm9OcnzRVy2J68yvvsHa4sT7ouX2UEifhQbfMhrDMi2X82PEyUbx6qncfUc=s88-c-k-c0x00ffffff-no-rj,UU_r-3nRot7wM0IrCJZ3LW2g,0,2026-06-07 01:49:25.211812+00,2026-06-07 01:49:25.211812+00
UC_xe0RC5hgGGRqCPg-BVxUA,PaintedWolf,"Painted Wolves (Lycaon pictus 1827) are not feral dogs (Canis lupus familiaris). Lycaon is Greek for a Germanic word Wolf. In 1916 the Rhodesian government authorized a bounty for 'VERMIN WILD DOG' pelts. There are 5 genera of 'wild' undomesticated canids in Africa, Lycaon, Lupulella, Otocyon, Vulpes, Canis can breed with domestic dogs

Africa once had over 500,000 painted wolves, packs of 100 were common, IUCN Red list 1,400 adults, and decreasing. Kruger averages 168 adults with a 3 year lifespan, IUCN Critically Endangered since 1990

RE: EWT: the 2 main causes of painted wolves deaths, on GKNP lions cause 90%, off Reserve humans cause 96%

painted wolves are not 'vicious, brutal, savage' they are only trying to survive

painted wolves have powerful jaws with specialized carnassial teeth to quickly slice and consume prey before kleptoparasites arrive, the prey dies quickly from shock or loss of blood",https://yt3.ggpht.com/ytc/AIdro_lFvK2VaxIwM1VnK6E9q55mK0uwe-jfh7OIvHO_1chHtBw=s88-c-k-c0x00ffffff-no-rj,UU_xe0RC5hgGGRqCPg-BVxUA,0,2026-06-07 01:49:25.211812+00,2026-06-07 01:49:25.211812+00
UC_xYMXx_-mAzheKyEtwtCAQ,Scientific American,Awesome discoveries. Expert insights. Science that shapes the world. This is the official YouTube Channel of Scientific American.,https://yt3.ggpht.com/bIUIF4Urp1ovk4GtgYv4683tmm92uBusvQqrmDT_HNKm4X95m1sDol3KCHz-XzLKivK-LFPR8A=s88-c-k-c0x00ffffff-no-rj,UU_xYMXx_-mAzheKyEtwtCAQ,0,2026-06-07 01:49:25.211812+00,2026-06-07 01:49:25.211812+00
UC-8g0HshRxIlzz1pCgfDLZw,Anuj Jindal,"Hello, I’m Anuj Jindal, your dedicated mentor and guide for acing competitive exams like RBI Grade B, SEBI Grade A, and NABARD Grade A. With my experience as a former SBI PO, a JRF in Commerce & Management, LLB, and a Diploma in Banking & Finance, I’ve walked the road you’re about to take, and I’m here to make it smoother, smarter, and inspiring for you.

Success in these exams isn’t just about studying for 5-6 hours daily; it’s about smart strategies, consistency, and believing in yourself. Together, we’ll transform challenges into stepping stones, ensuring your preparation is not just productive but also uplifting!

If you want to connect with me, feel free to reach out at info@anujjindal.in or through 9999466225. You can also book a counselling session with me by clicking on the link attached. Let’s turn your dreams into reality!

Session Booking Link:",https://yt3.ggpht.com/ytc/AIdro_mMlm7IPX8O4H1CtThzbHMzw-btDj4yAWdZggVumkW3dso=s88-c-k-c0x00ffffff-no-rj,UU-8g0HshRxIlzz1pCgfDLZw,0,2026-06-07 01:49:25.211812+00,2026-06-07 01:49:25.211812+00
UC-d_Ua_G13Gj-Hr-hzWJnlg,Laura Doran,"Teacher (and other miscellaneous stuff)
L",https://yt3.ggpht.com/ytc/AIdro_mKgSXkYQZ64KM_b5kPdGGYuNA17lupmC5wFkAvayAwERo=s88-c-k-c0x00ffffff-no-rj,UU-d_Ua_G13Gj-Hr-hzWJnlg,0,2026-06-07 01:49:25.211812+00,2026-06-07 01:49:25.211812+00
UC-sM_PLqzgktdUcW2LEKKkQ,The Midnight,"There is a Japanese term: Mono no aware. It means basically, the sad beauty of seeing time pass - the aching awareness of impermanence. These are the days that we will return to one day in the future only in memories.

The Midnight consists of Tyler Lyle (a songwriter from the Deep South) and Tim McEwan (a producer from Denmark).

The new album 'Syndicate' is out now.",https://yt3.ggpht.com/riW9u2z3Rre7XIWtCQUb9avUpi0f0q6oJeHRNwiUOj3eODZxLGcDzkWKki9Lw7NOG1xGVmSX6A=s88-c-k-c0x00ffffff-no-rj,UU-sM_PLqzgktdUcW2LEKKkQ,0,2026-06-07 01:49:25.211812+00,2026-06-07 01:49:25.211812+00
UC-tZk0bsaiq9KANWZ2BPO8w,Dailytekk,The hidden side of modern life. Making videos since 2015. Get the book:  For biz inquiries only: youtube@dailytekk.com,https://yt3.ggpht.com/gXMHzTS2i84jCI6-jsgGDDMXt84StmpIuWoV-jjQoNNu7NJMIdZ9SgDk0GyknLE1vdP9acHllA=s88-c-k-c0x00ffffff-no-rj,UU-tZk0bsaiq9KANWZ2BPO8w,0,2026-06-07 01:49:25.211812+00,2026-06-07 01:49:25.211812+00
UC-ZA3QN2nDmqOSujn8zvNjw,CreativeMornings HQ,"CreativeMornings is a breakfast lecture series for the creative community - and so much more. We’re the world’s largest face-to-face creative community; hosting local events every Friday, virtual FieldTrips every week, and jobs postings via the CreativeGuild.

In 2008, Tina Roth Eisenberg (Swissmiss) started CreativeMornings out of a desire for an ongoing, accessible event for New York’s creative community. The concept was simple: a free talk and breakfast one Friday morning a month. 

Today, our community gathers in cities around the world to enjoy an inspiring talk, coffee and breakfast. Our volunteer hosts and their teams organize local chapters that not only celebrate a city’s creative talent, but also create an open space to connect with other creative individuals.

We believe that everyone is creative and everyone is welcome. We hope you enjoy this archive of past talks.",https://yt3.ggpht.com/ytc/AIdro_nL6l3AhV7y5p8mXxPSx6TJkjjBXfVumvASWs_pQIDaKwk=s88-c-k-c0x00ffffff-no-rj,UU-ZA3QN2nDmqOSujn8zvNjw,0,2026-06-07 01:49:25.211812+00,2026-06-07 01:49:25.211812+00
UC06CSMqAhpBvhSRwHUBgyPw,Voice Of Telugu,"Voice Of Telugu 
A Telugu Motivational Youtube Channel,
You can find, Telugu motivational videos, Telugu motivational speeches, Telugu motivational words, Telugu motivational life stories, Telugu motivational speech for success in life, Inspirational videos in Telugu, Inspirational Life Stories in Telugu, Inspirational speeches for success in life, Evergreen Telugu motivational stories of life, Latest best motivational videos in Telugu, Motivational Videos for self-confidence, Videos for Positive Thinking in Telugu, Motivational videos from all religions, Positive things from Bhagavadgeetha, Quran, Bible , Moral stories in Telugu, Inspirational videos, Inspirational speeches, Latest Best Telugu Motivational Video for Students,Telugu Inspirational Videos 

To get such Motivational/positive audios or videos
(Save this number first  +91 97000 55310)
(Note: No calls please, may not respond to msgs always)
(Contact Email : voiceofteluguofficial@gmail.com)

Thank you 
Voice Of Telugu",https://yt3.ggpht.com/ytc/AIdro_kQP8UGMNCHivNaf_bUf9TJUG2iR24t2xzeV_WFaTzj43A=s88-c-k-c0x00ffffff-no-rj,UU06CSMqAhpBvhSRwHUBgyPw,0,2026-06-07 01:49:25.211812+00,2026-06-07 01:49:25.211812+00
UC0cd_-e49hZpWLH3UIwoWRA,Professor Dave Explains,"Welcome! I have a knack for explaining stuff and I want to share some knowledge with you.

I received a BA in chemistry from Carleton College, and performed graduate studies in both synthetic organic chemistry and science education at Cal State Northridge, receiving an MA in the latter. Prior to this I taught for about a decade in various high school and undergraduate settings, specializing in organic chemistry but also teaching general chemistry, physics, and biology.

This channel is for students at the high school and undergraduate level, but it is also for members of the general public who just want to know more about the world and how things work. My goal is to increase science literacy in our society, so please share these tutorials with anyone that you think might enjoy them. Happy learning!

Support my channel: 

Check out my book ""Is This Wi-Fi Organic?"": 

OChem help here:",https://yt3.ggpht.com/ytc/AIdro_lQiE1t-NjUuQDjIdIDpgyszdS3hI5TlIqZ1lr3PDewKDk=s88-c-k-c0x00ffffff-no-rj,UU0cd_-e49hZpWLH3UIwoWRA,0,2026-06-07 01:49:25.211812+00,2026-06-07 01:49:25.211812+00
UC0L6JWsZGGRrZyf3-0ewXiA,Neelesh Alapati,"Hi! I’m Neelesh Alapati ,
Like and  to join my world of exploring dreams.",https://yt3.ggpht.com/cFuvrqc27p1gBwurLUf6RX-7XRZtGIePjt_yhgOfkgIMGKE1ZbGm8KnZSYnZjisHeYBQKXac=s88-c-k-c0x00ffffff-no-rj,UU0L6JWsZGGRrZyf3-0ewXiA,0,2026-06-07 01:49:25.211812+00,2026-06-07 01:49:25.211812+00
UC10bxQVVz1dJSIUC-f5hJdA,BigCatDerek,"Hi, my name is Derek and I'm the resident unofficial attention-seeker for the Center for Animal Research and Education (CARE), a non-profit big cat sanctuary in Texas. 

I've been working with big cats for over 15 years, and my wife, Heidi, is CARE's Founder & Executive Director. She's a pretty cool lady. Since CARE is a non-profit, I don't ""own"" any of the cats shown in my videos, but I think of them as my dearest friends, my babies.

Anyway, hope you like the vids!

-Derek",https://yt3.ggpht.com/ytc/AIdro_nEqL5ojGkEPB3-tB-Z4GF7K5yoTP_-n33BWVmrW4c1M9o=s88-c-k-c0x00ffffff-no-rj,UU10bxQVVz1dJSIUC-f5hJdA,0,2026-06-07 01:49:25.211812+00,2026-06-07 01:49:25.211812+00
UC1DmGCLiHRCX6HTbyLRYVqg,BUBU DUDU SWARATOONZ,"Welcome !!!  So you are here to know about my channel 😂.

There are two main characters, Peach and Goma who are very much in love. They have two kids, a gal (baby bubu) and boy(baby dudu) ❤️. They  are cute  and naughty.
They have a super cute and sometimes annoying neighbour named Dr Sunny who have a crush on their beautiful friend Diana… and rest you can watch on my channel.

My stories are funny , naughty and relatable ❤️❤️❤️… and if you like my channel then don’t forget to  for latest contents.

If you like to support my channel , you can donate on paypal and super  thanks option is  enabled now on all videos.
You can reach out to me on my Instagram for any suggestions.You can DM for any paid collaboration directly.",https://yt3.ggpht.com/lJ1JK4dmrygPhRVqLOO2k_DyLnZs5wChsUZi_Izr-ythXNoGJkyp1cZo3REfre69BXPMYm3A=s88-c-k-c0x00ffffff-no-rj,UU1DmGCLiHRCX6HTbyLRYVqg,0,2026-06-07 01:49:25.211812+00,2026-06-07 01:49:25.211812+00
UC1H2n5ecKOViBkTYjJwBqhg,Stay Fit,"Welcome to my Official Channel Stay Fit. Do check out StayFit.com and please Like, Share and  my channel. Thanks
“I hated every minute of training, but I said, ‘Don’t quit. Suffer now and live the rest of your life as a champion.” – Muhammad Ali

case id: 4702000035379",https://yt3.ggpht.com/tN13D2MgznN_itoi2EwMMmiJzwpAwHtalHuddkXUeRPoRXlq9_HyDdtU_2o62B71BNzMme5U=s88-c-k-c0x00ffffff-no-rj,UU1H2n5ecKOViBkTYjJwBqhg,0,2026-06-07 01:49:25.211812+00,2026-06-07 01:49:25.211812+00
UC24BncXKSEBLcVnc8fBUX5w,Edinburgh Zoo,"Welcome to the Royal Zoological Society of Scotland's Edinburgh Zoo!

Our wildlife conservation charity has a bold vision: a world where nature is protected, valued and loved.

Edinburgh zoo is a gateway to the natural world where people can experience nature, learn about the challenges facing wildlife and discover how we harness the unique power of the RZSS family – our teams, supporters and partners – to save animals from extinction.",https://yt3.ggpht.com/ytc/AIdro_maBcdUBMJfe5Ymeb1kX-8eP7JOe5uB_KdTmn7NPOb1zIQ=s88-c-k-c0x00ffffff-no-rj,UU24BncXKSEBLcVnc8fBUX5w,0,2026-06-07 01:49:25.211812+00,2026-06-07 01:49:25.211812+00
UC2bkHVIDjXS7sgrgjFtzOXQ,engineerguy,Bill Hammack explores the world of engineering,https://yt3.ggpht.com/ytc/AIdro_nuhE0c6lwwmYFK-RG44MOSrPYaE_iQlxM5FEKCxd4CBEc=s88-c-k-c0x00ffffff-no-rj,UU2bkHVIDjXS7sgrgjFtzOXQ,0,2026-06-07 01:49:25.211812+00,2026-06-07 01:49:25.211812+00
UC2P9wURjFXsOSzFbR0hnYag,PaintedDog TV,"There are times when the lightning speed of technology seems to have saturated the world with information. Never before has the human race been presented with so many ways to satisfy its attention span.

Brent and Wium saw this inexorable march towards a media-driven world and embraced it with open arms as an opportunity to tell the stories of their beloved wilderness in a unique and personal way.

Together they created PaintedDog.TV as a way to immerse each and every viewer in the natural world: to show you, the viewer, the beauty of Africa without shying away from the hardships facing her animals and wild spaces in our ever-developing world. Their unflinching approach to honesty means a down-to-earth and personal look at their behind-the-scenes moments, revealing the highs and lows documentary making.",https://yt3.ggpht.com/ytc/AIdro_lwvfQcL14L0QbztLo1LacCo0HAQ-w8IRb1Df5LpTvOLa0=s88-c-k-c0x00ffffff-no-rj,UU2P9wURjFXsOSzFbR0hnYag,0,2026-06-07 01:49:25.211812+00,2026-06-07 01:49:25.211812+00
UC3j3w-oUtIAm_KI857ydvUA,Thoisoi2 - Chemical Experiments!,On this channel you will find some interesting chemical reactions and many amazing stuff!,https://yt3.ggpht.com/ytc/AIdro_ni4aySOqIHB2stybArF7bjwqm4ju_ijk6b5H7xd1Qdeqo=s88-c-k-c0x00ffffff-no-rj,UU3j3w-oUtIAm_KI857ydvUA,0,2026-06-07 01:49:25.211812+00,2026-06-07 01:49:25.211812+00
UC3njZ48-FDxLleBYaP0SZIg,The Hindu,"This is the official channel of The Hindu, one of the largest English newspapers in India. Our videos cover current affairs, politics, science, technology, entertainment, movies and more. We provide expert commentary by our seasoned journalists on developments on the national and international fronts, relating to politics and policy. We also report from the ground, across India, on events and people of importance and interest.",https://yt3.ggpht.com/ytc/AIdro_noBA8yminc26WM23DspWUL9P_mrUoZXhPH5uX8dq9gsfA=s88-c-k-c0x00ffffff-no-rj,UU3njZ48-FDxLleBYaP0SZIg,0,2026-06-07 01:49:25.211812+00,2026-06-07 01:49:25.211812+00
UC3pFVvw_HwykroUwLRdfRkg,Star Maa Music,,https://yt3.ggpht.com/hnrLDikt6J3z5Ht_8cD1TV64sMe6Mw9pdeUy2wmY112DTBEr1RsosZf3RJDjpuautb6Uf5JksA=s88-c-k-c0x00ffffff-no-rj,UU3pFVvw_HwykroUwLRdfRkg,0,2026-06-07 01:49:25.211812+00,2026-06-07 01:49:25.211812+00
UC3XTzVzaHQEd30rQbuvCtTQ,LastWeekTonight,"Breaking news on a weekly basis. Sundays at 11PM - only on HBO.
 to the Last Week Tonight channel for the latest videos from John Oliver and the LWT team.",https://yt3.ggpht.com/QaQBhlazp19dgOWR8qsqBUmfR1HgDoonchOyWoZAlW68nT6ezDQ75nPdwKT1fjR74uYSvlgX=s88-c-k-c0x00ffffff-no-rj,UU3XTzVzaHQEd30rQbuvCtTQ,0,2026-06-07 01:49:25.211812+00,2026-06-07 01:49:25.211812+00
UC4dNKl9eG7s2WbdZ83t-BIQ,ᴘʀᴏᴍᴏᴛɪɴɢ ᴛᴀʟᴇɴᴛꜱ,We promote talents 🦢💗,https://yt3.ggpht.com/rp9KurCqM-XTRT5PYAH9Mg3kqbTF9v9DPH6KAqE3H1Oq8n_lkMceSMy4yh3jAtSnHPlnD2pAVg=s88-c-k-c0x00ffffff-no-rj,UU4dNKl9eG7s2WbdZ83t-BIQ,0,2026-06-07 01:49:25.211812+00,2026-06-07 01:49:25.211812+00
UC4JTGaljFOVU93AReRNa-5g,SCAR,"to learn about the history of Legendary Lions of our planet....!




Contact info :- ContactScarForInquiries@gmail.com",https://yt3.ggpht.com/QKQkoy4dqXuPLtuBHryoF51UpQ-weBH3qPJShz3QetvySRXP6GxdsYiFBj8rhVU5tt5Ii_3n-g=s88-c-k-c0x00ffffff-no-rj,UU4JTGaljFOVU93AReRNa-5g,0,2026-06-07 01:49:25.211812+00,2026-06-07 01:49:25.211812+00
UC4rlAVgAK0SGk-yTfe48Qpw,BRIGHT SIDE,"Whether you’re into recent discoveries, space exploration, true stories, fitness, fun tests, and riddles, or useful tips for self-improvement, psychology, gadgets, or just your day-to-day routine, there’s something for everyone!

You can expect all that and more coming at you in 3 top-quality videos every single day. If you’ve got a thirst for knowledge that never quits, then join a community of tens of millions and growing! We have a good time, so take your shoes off, kick back, and make yourself at home here on the Bright Side of life!

Good news! We launched a new app for you 👉 
Join the world's largest community of good people! 😉

For brand partnership enquires: brands@thesoul-publishing.com",https://yt3.ggpht.com/BimIuq2UYH1h-GQDEiV89I1dUEtpWVR8Mp_Q516vPN8rLw488Ap1G9ALhPUyqN8_HTPMbawTBDk=s88-c-k-c0x00ffffff-no-rj,UU4rlAVgAK0SGk-yTfe48Qpw,0,2026-06-07 01:49:25.211812+00,2026-06-07 01:49:25.211812+00
UC50hnY4tjBGC4fn8_qNclew,Vaids ICS Delhi,This is the official YouTube channel for Vaid's ICS Delhi,https://yt3.ggpht.com/ytc/AIdro_lPvPSdswjuML1n28Hyg36zGWAMMJ3mJxVR37RsjGBP0NA=s88-c-k-c0x00ffffff-no-rj,UU50hnY4tjBGC4fn8_qNclew,0,2026-06-07 01:49:25.211812+00,2026-06-07 01:49:25.211812+00
UC50TJ2nHy9P1Ca2QMJbAZxw,Frontiers,"Frontiers is a leading research publisher, publishing groundbreaking discoveries by experts from around the world.

Scientists empower society, and our mission is to accelerate scientific discovery by making science open. We place the researcher at the center of everything we do and enable the research community to develop solutions for healthier lives and a healthier planet.

Featuring custom-built technology, artificial intelligence, and rigorous quality standards - our research articles reflect the power of open and accessible research for all.",https://yt3.ggpht.com/wn1ld96RggzPsrnco6h_IBWsmIH1vs-0P7vAnszaCH_y5IQUQSe0sTHN5OLmGw247rQHKkUTMg0=s88-c-k-c0x00ffffff-no-rj,UU50TJ2nHy9P1Ca2QMJbAZxw,0,2026-06-07 01:49:25.211812+00,2026-06-07 01:49:25.211812+00
UC57kv9u2zRWk6n8sTrhgIUg,More GMHikaru,More GM Hikaru videos,https://yt3.ggpht.com/ytc/AIdro_npPZkIZwJhe_s0t-2nXJbbnB3X-hZG_M32mE9qV9t9LFg=s88-c-k-c0x00ffffff-no-rj,UU57kv9u2zRWk6n8sTrhgIUg,0,2026-06-07 01:49:25.211812+00,2026-06-07 01:49:25.211812+00
UC5kS0l76kC0xOzMPtOmSFGw,Chess.com,Chess.com is the world’s #1 chess community with millions of players and fans. Join today!,https://yt3.ggpht.com/ce_EvpNlsbZTXRNLOoDVy8ZhHZcYEHVHefwdg9d0x7BZAk5AGXFteEILFmrBnGF_LLvE1HEU3LE=s88-c-k-c0x00ffffff-no-rj,UU5kS0l76kC0xOzMPtOmSFGw,0,2026-06-07 01:49:25.211812+00,2026-06-07 01:49:25.211812+00
UC5Lz88Rt3GT75YT2ORAmaMQ,Cornell Lab of Ornithology,"The Cornell Lab of Ornithology is a membership institution dedicated to interpreting and conserving the earth's biological diversity through research, education, and participatory science focused on birds. Visit the Cornell Lab's web site at",https://yt3.ggpht.com/ytc/AIdro_mWyyMm1sh7Hi_KjbY3eC3ZWrdVs3eYUQld3XvU00ThzMw=s88-c-k-c0x00ffffff-no-rj,UU5Lz88Rt3GT75YT2ORAmaMQ,0,2026-06-07 01:49:25.211812+00,2026-06-07 01:49:25.211812+00
UC5NcNJPRh5KGc-0K3IpBZ5Q,Парк Львов Тайган. Татьяна Алексагина.,"№ 4941435938 ПАРК ЛЬВОВ ТАЙГАН!!! КРЫМ. БЕЛОГОРСК

По вопросам рекламы:

youadvpiar@gmail.com

Крупнейший в Европе питомник львов и других видов животных, в основном крупных млекопитающих. Тайган так -же является приютом для всех животных попавших в беду. На данный момент на территории парка площадью более чем 30 гектаров, свободно проживает около 50 львов, 50 тигров, а также тысячи  других животных.
На территории парка находится гостиница, несколько кафе.

Телефон администратора парка +7(978)8639006 по заказу номера в гостинице и вопросам по работе парка.

Друзья, мы создали новый канал, на котором создатель Парка Львов ""Тайган"" и Зоопарка ""Сказка"" сам будет рассказывать о своих парках, своей жизни и конечно своих львах! ПОДПИСЫВАЙТЕСЬ НА НОВЫЙ КАНАЛ  ""Олег Зубков ЧЕЛОВЕК  ЛЕВ"" Все самое интересное ЗДЕСЬ !!! 


ПО ВОПРОСАМ СОТРУДНИЧЕСТВА : aleksagina1967@gmail.com",https://yt3.ggpht.com/ytc/AIdro_ncMJu7HEesJKKEh94Jp5SYMGpZvgZbTqbZUALITWeVy1k=s88-c-k-c0x00ffffff-no-rj,UU5NcNJPRh5KGc-0K3IpBZ5Q,0,2026-06-07 01:49:25.211812+00,2026-06-07 01:49:25.211812+00
UC5now6fjIJvXEXtb7K-d8gA,CasuallyListening,Random things that interest me.,https://yt3.ggpht.com/ytc/AIdro_nRNrU7ntlJMplc-S4KbeC7ol59Bv2PGYcDNpkEavE=s88-c-k-c0x00ffffff-no-rj,UU5now6fjIJvXEXtb7K-d8gA,0,2026-06-07 01:49:25.211812+00,2026-06-07 01:49:25.211812+00
UC6-ymYjG0SU0jUWnWh9ZzEQ,Wisecrack,"Wisecrack is a collective of academics, filmmakers, artists, and pop culture junkies who are curious and contemplative about the world around us. Wisecrack is a collective of academics, filmmakers, artists, and pop culture junkies who are curious and contemplative about the world around us.",https://yt3.ggpht.com/ytc/AIdro_nyXfPRVdx4LJlvEPL_EBp5QG6Xqev6hOHf_eHFLNGvjMo=s88-c-k-c0x00ffffff-no-rj,UU6-ymYjG0SU0jUWnWh9ZzEQ,0,2026-06-07 01:49:25.211812+00,2026-06-07 01:49:25.211812+00
UC60U1OtwT9Y6Buecc6P0L5g,iDream Media,"iDream Media brings audiences closer to the heart of Indian cinema with engaging content that includes iDream interviews and iDream celebrity interviews featuring top stars and filmmakers. From iDream Tollywood interviews to iDream latest interviews, fans get an exclusive look into the world of movies and entertainment. For film lovers, iDream movies and iDream Telugu movies provide a wide range of cinematic experiences, while iDream full movies and iDream exclusive interviews ensure non-stop entertainment. With a variety of iDream videos covering updates, behind-the-scenes stories, and candid conversations, iDream Media has become the go-to destination for Entertainment.

#idreamcelebrities #idreampopular #idreamteluguworld  #idreamvison #idreamtrending #idreamvideos #idreammovies
#iDreamMedia #iDreamInterviews #iDreamMovies #iDreamVideos #TeluguMovies #iDreamFullMovies #CelebrityInterviews 

 to iDream Media :",https://yt3.ggpht.com/tV2Yqh4_RoUUVO_b6EviBR6htSLLAovpsBGiJecwvul_fDfY4SntBlKf-eDGyllybOSXk4fQqg=s88-c-k-c0x00ffffff-no-rj,UU60U1OtwT9Y6Buecc6P0L5g,0,2026-06-07 01:49:25.211812+00,2026-06-07 01:49:25.211812+00
