id,title,description,thumbnail_url,uploads_playlist_id,subscriber_count,last_synced_at,created_at
UCmQRypK6kAcujJAlYZpFW8Q,PETA (People for the Ethical Treatment of Animals),"You are watching Animal Rights Television®.

People for the Ethical Treatment of Animals (PETA) is the largest animal rights organization in the world, and PETA entities have more than 10 million members and supporters globally.

PETA opposes speciesism, a human-supremacist worldview, and focuses its attention on the four areas in which the largest numbers of animals suffer the most intensely for the longest periods of time: in laboratories, in the food industry, in the clothing trade, and in the entertainment business. We also work on a variety of other issues, including the cruel killing of rodents, birds, and other animals who are often considered “pests” as well as cruelty to domesticated animals.

PETA works through public education, investigative news gathering and reporting, research, animal rescue, legislation, special events, celebrity involvement, and protest campaigns.

Ready to get active for animals? Check out",https://yt3.ggpht.com/xKHJFLRKsEsaTYcJSa3NEzYHbhO2Mnvu4cWt0E7zRt661ry3isTL8s9sJ2LqQt85Zflvc46z0A=s88-c-k-c0x00ffffff-no-rj,UUmQRypK6kAcujJAlYZpFW8Q,0,2026-06-07 01:49:25.211812+00,2026-06-07 01:49:25.211812+00
UCMtFAi84ehTSYSE9XoHefig,The Late Show with Stephen Colbert,"Welcome to the official YouTube channel for ""The Late Show with Stephen Colbert""! Weeknights at 11:35pm/10:35c.

Stream on Paramount+. www.paramountplus.com/lateshow",https://yt3.ggpht.com/ytc/AIdro_m65RzRXyEAIlIg5E84TdMr1Q-8uVzCoAjGOR4GjR9AnCQ=s88-c-k-c0x00ffffff-no-rj,UUMtFAi84ehTSYSE9XoHefig,0,2026-06-07 01:49:25.211812+00,2026-06-07 01:49:25.211812+00
UCMu5gPmKp5av0QCAajKTMhw,ERB,The Epic Rap Battles of History is a comedy series created by Nice Peter & epicLLOYD. In over 15 years we have created over 90 rap battles featuring both historical and fictional characters which have amassed over 4+ billion views on YouTube.,https://yt3.ggpht.com/Ld2BD3gMo62U2fADeFk0jXauQkqElTtFfkmloIJcN7zk94qG68em0jabsHUYtXQkeO5i4WxCHLg=s88-c-k-c0x00ffffff-no-rj,UUMu5gPmKp5av0QCAajKTMhw,0,2026-06-07 01:49:25.211812+00,2026-06-07 01:49:25.211812+00
UCNF-vGnm1jdA_jhrIpk84Tg,CEEWIndia,"The Council on Energy, Environment and Water (CEEW) is one of Asia’s leading not-for-profit policy research institutions. The Council uses data, integrated analysis, and strategic outreach to explain – and change – the use, reuse, and misuse of resources. It prides itself on the independence of its high-quality research, develops partnerships with public and private institutions, and engages with the wider public. The Council has also been consistently ranked among the world’s top climate change think tanks.

The Council's research spans areas such as energy access, renewables, power sector, sustainable food systems, air quality, climate risks, water governance, industrial sustainability & competitiveness, low-carbon pathways, sustainable mobility, sustainable cooling, climate engineering governance and climate negotiations.",https://yt3.ggpht.com/PWFxuYELKUiI72YdocoE8XYW1bLHJ56o3PaTciZgz5VtkWEo9St5qvoSZfadQ1XYUIdJA7--2Q=s88-c-k-c0x00ffffff-no-rj,UUNF-vGnm1jdA_jhrIpk84Tg,0,2026-06-07 01:49:25.211812+00,2026-06-07 01:49:25.211812+00
UCNJcSUSzUeFm8W9P7UUlSeQ,The Viral Fever,"Lights, Camera, Experiment.  to The Viral Fever for your weekly dose of humor & drama. 

With over 12 Million rs, The Viral Fever is India's leading online entertainment company. This is the team behind acclaimed and widely loved web series like Aspirants, Kota Factory, Panchayat, Gullak, Flames, The Aam Aadmi Family, Pitchers, Permanent Roommates, Tripling, Humorously Yours, Yeh Meri Family, and Bachelors. TVF has created young India's favorite digital entertainment, catering to their changing tastes and trends. 

For Business and Partnerships: business@theviralfever.com

This Channel is owned, operated, and managed by, Contagious Online Media Network Private Limited.",https://yt3.ggpht.com/ytc/AIdro_lMaG31N6SdaMEkagNlbn8Q7Ta3NV7eC2xhqpGF_MHoc-0=s88-c-k-c0x00ffffff-no-rj,UUNJcSUSzUeFm8W9P7UUlSeQ,0,2026-06-07 01:49:25.211812+00,2026-06-07 01:49:25.211812+00
UCNKSG9SSX8j50kF6LyzJAhg,Geethanjali Academy,"Welcome to Geethanjali Academy, your premier digital institution for mastering traditional Indian arts, holistic wellness, and cultural lifestyle.

What You Can Learn Here:
Indian Classical Dance Mastery: From foundational steps to advanced performances, learn Bharatanatyam, Kathak, and Mohiniyattam through detailed beginner guides.
Music & Instruments: Explore the depths of Carnatic Vocal music, Raga masterclasses, and learn to play traditional instruments like the Veena, Harmonium, and Flute.
Yoga for Holistic Wellness: Achieve your fitness goals with our Yoga series, and explore asanas for stress relief, flexibility, and therapeutic healing.
Ayurvedic Massage & Remedies: Discover the healing power of Shiro Abhyangam and foot reflexology, alongside natural ""Grandmother’s Secret Recipes"" for common health ailments.
Cultural Style & Heritage: Master the art of Saree Draping (including Kerala, Gujarati, and Mumtaz styles) and discover the Science of Tradition behind Indian customs.",https://yt3.ggpht.com/np-cyLoaHMgRttmtbLZVcUvWCd9SV7g3B4a_crgoOlUFudcZCs-mxGp4gTQntYCTcBPhOLlRUg=s88-c-k-c0x00ffffff-no-rj,UUNKSG9SSX8j50kF6LyzJAhg,0,2026-06-07 01:49:25.211812+00,2026-06-07 01:49:25.211812+00
UCNqNkZ7kKfqimqHkgbWMNYA,Launch Pad Astronomy,"Welcome to Launch Pad Astronomy! I'm Christian Ready, your friendly neighborhood astronomer, and this channel is the place to geek out on the universe and understand how it works, all in plain english.

When I was 13 years old, I started working at the Sproul Observatory at Swarthmore College. I helped with observing, analysis, and monthly open houses. I was instantly hooked on sharing the universe with others. Other highlights include working on the Hubble Space Telescope and teaching astronomy at Towson University (I’m probably skipping a couple of decades here and there, but you get the idea).

I upload once per week, though my exact schedule varies with my teaching schedule every semester. But if you  and hit the notification icon, you’ll always know when my latest videos are uploaded. 

Otherwise, you can find us at  and",https://yt3.ggpht.com/ytc/AIdro_nDDSRP0d0ieRhfjq_TFyHqavL31wgxl6q3KNz_fNTVu9o=s88-c-k-c0x00ffffff-no-rj,UUNqNkZ7kKfqimqHkgbWMNYA,0,2026-06-07 01:49:25.211812+00,2026-06-07 01:49:25.211812+00
UCNVfnQhGIHVZrEZdYniIgWg,Sound of Picture,Sound of Picture presents instrumental music from Portland composer Chad Crouch who released music under the name Podington Bear from 2007 -2017.  Use Sound of Picture music in your projects:,https://yt3.ggpht.com/ytc/AIdro_lBnO55wj0iqbnmWko8e10Vc8zeqSzr5bbeHm_6rVp8gQg=s88-c-k-c0x00ffffff-no-rj,UUNVfnQhGIHVZrEZdYniIgWg,0,2026-06-07 01:49:25.211812+00,2026-06-07 01:49:25.211812+00
UCnVUnrbUIOoxiQQYPncQc4Q,Bharath IAS,,https://yt3.ggpht.com/ytc/AIdro_k6dIQSXnANzzhPkq6yv7F702VTTU1bn8gxim5qlqDKmzw=s88-c-k-c0x00ffffff-no-rj,UUnVUnrbUIOoxiQQYPncQc4Q,0,2026-06-07 01:49:25.211812+00,2026-06-07 01:49:25.211812+00
UCnxasntt2LfGQzhQiqaUw8g,Owen,"Owezard is your home for Pokémon TCG pack openings, alt-art hunts, grading insights (PSA-10 focus), market comps, pop-report talk, and high-energy recaps—hosted by Owen. Family-friendly, collector-first content designed to help you learn, collect, and have fun.
Uploads most weeks + Shorts.

📸 @OwezardPokemon • 🌐 Owezard.com

Not affiliated with The Pokémon Company/Nintendo/Game Freak.",https://yt3.ggpht.com/GQj8rOv-xnha4bGu-QTBANkJXwToimtNzGVkQniJ42d3PnusuvGz2_ezpjX8emjMeWyIqTzuEQ=s88-c-k-c0x00ffffff-no-rj,UUnxasntt2LfGQzhQiqaUw8g,0,2026-06-07 01:49:25.211812+00,2026-06-07 01:49:25.211812+00
UCo-ElOvpzkht6cHr2jFRGow,Bubuanddudu,"Just two cute bears trying to make you smile every day 🐼🐻
Your one  means a lot to us 🥺💞
It helps us keep creating cute stories for you every day ✨

For any business purpose:-  bubuanddudu100@gmail.com

Hope you're having a good day:)

You can support here:
UPI ID: 9142440837@ybl
PayPal Account: rabiyanoor260@gmail.com",https://yt3.ggpht.com/5k2OY2XEPKKfSQLA5xke6PA4qaABsM59yorWnA7boVe7btK7gOIMtB-2fiZN5Yw1hpnSHfNuYw=s88-c-k-c0x00ffffff-no-rj,UUo-ElOvpzkht6cHr2jFRGow,0,2026-06-07 01:49:25.211812+00,2026-06-07 01:49:25.211812+00
UCODmToQ4BpERPaEbNT5IPqw,MIT ChemE,MIT Department of Chemical Engineering,https://yt3.ggpht.com/ytc/AIdro_lBisN-Mw3Zi_ehuNgSZvQ7csT5nzfPjEZEN7v0zbHc6g=s88-c-k-c0x00ffffff-no-rj,UUODmToQ4BpERPaEbNT5IPqw,0,2026-06-07 01:49:25.211812+00,2026-06-07 01:49:25.211812+00
UCOf9kh3dTPcL1bnB2gdKIEQ,Олег Зубков - ЧЕЛОВЕК ЛЕВ Oleg Zubkov - LION MAN (Я и мои львы Тайган),"Только по вопросам рекламы:

youadvpiar@gmail.com",https://yt3.ggpht.com/ytc/AIdro_knF7k9AoL8CsCJz66svzDAjMfyLBYmPrJT1Mi7hg8JkRo=s88-c-k-c0x00ffffff-no-rj,UUOf9kh3dTPcL1bnB2gdKIEQ,0,2026-06-07 01:49:25.211812+00,2026-06-07 01:49:25.211812+00
UCOfkswTnTTH3ARzPrvBKXAQ,NAVI-Klaus Clash of Clans🥇,"Builder at @BlueprintCoC Shop My Base Pack here: 

team : NAVI
twitter : @Klaus_coc
code : KlausJP

World Championship 
　　-2020 #2🥈
　　-2021 #2🥈
　　-2022 #1🥇& MVP",https://yt3.ggpht.com/vG25WnAxcnCDJupNmV71khEPa2nQLxfdmWXhjNCozLfGEFDROgwIUJa3Ol1J0Vgjp_3uni6ziv8=s88-c-k-c0x00ffffff-no-rj,UUOfkswTnTTH3ARzPrvBKXAQ,0,2026-06-07 01:49:25.211812+00,2026-06-07 01:49:25.211812+00
UCOg7A2R3FZxcoNlV67HNCHA,Abhey Kumar,"For those who seek to learn about India's Governance system.
Specific focus is to assist those who are preparing for Civil Services Exams, especially the UPSC CSE.

The Channel aims to provide:
a) General guidance on preparation for CSE, including talks with toppers of recent years' exams.
b) Guidance on preparing for Indian Polity - Prelims as well as Mains oriented, targeted resources.
c) An administrative (and, Civil Service aspirants') perspective on latest developments in governance of India.",https://yt3.ggpht.com/ytc/AIdro_nyZfamsu7gZd-PjPGWGwUZJFi2yD4Ymn6o5zQ9XUVQFxI=s88-c-k-c0x00ffffff-no-rj,UUOg7A2R3FZxcoNlV67HNCHA,0,2026-06-07 01:49:25.211812+00,2026-06-07 01:49:25.211812+00
UConVfxXodg78Tzh5nNu85Ew,Welch Labs,New Book! The Welch Labs Illustrated Guide to AI is now available for pre-order:,https://yt3.ggpht.com/2iLVDebIe8qFdyAjY48p8XVZYmIA4umizNlZNmURd7q2OOWJLDBD5qQjlLZTUnkehcMIqEHfDw=s88-c-k-c0x00ffffff-no-rj,UUonVfxXodg78Tzh5nNu85Ew,0,2026-06-07 01:49:25.211812+00,2026-06-07 01:49:25.211812+00
UCoOmmbxxZxL9833L21LR-_Q,Rajan Singh - HabitStrong Founder,"I'm  Rajan Singh, an IITian, ex-IPS officer, Wharton MBA, and McKinsey alum. I help build life-changing habits @ HabitStrong.

HabitStrong helps you build life-changing habits — digital detox, morning routine, daily meditation, and productivity.

Follow Rajan on Linkedin —",https://yt3.ggpht.com/3Lqc5D7Q9bVKh7tSB4eoWWJXueHTmx02WSV7NYV2wfkdHuXMd6i_50z0tTXl21ETEPp9lXQA5g=s88-c-k-c0x00ffffff-no-rj,UUoOmmbxxZxL9833L21LR-_Q,0,2026-06-07 01:49:25.211812+00,2026-06-07 01:49:25.211812+00
UCOQN5u9oIocoYEdn3LQID4Q,But Why?,"This is a channel dedicated to my 15 year old self who had a desire to learn, but didn't quite have the toolbox to fully understand everything around him. I create videos trying to explain things in a manner I believe I would have understood back then.",https://yt3.ggpht.com/aBvCmzuQsw2-fbowIoRuNsz0c4O1gKZN5Vy5iT273q8ktVbx7fHaLm_l3w1Gvp3sNhLa32mopD4=s88-c-k-c0x00ffffff-no-rj,UUOQN5u9oIocoYEdn3LQID4Q,0,2026-06-07 01:49:25.211812+00,2026-06-07 01:49:25.211812+00
UCOQNJjhXwvAScuELTT_i7cQ,Sony LIV,"Unleashing 40,000+ hours of binge-worthy stories for you. From exclusive new LIV Originals to International Series to all of Sony TV shows to LIVE sports – all just a tap away with #AllNewSonyLIV. Coming Soon.",https://yt3.ggpht.com/DpGHd6R0i3jgWquotYXpOsVPALAuWD9e_U7fohnMy4Vo3EANA-2v0YKtaMMgRa_OZ1nemOib=s88-c-k-c0x00ffffff-no-rj,UUOQNJjhXwvAScuELTT_i7cQ,0,2026-06-07 01:49:25.211812+00,2026-06-07 01:49:25.211812+00
UCoY_p16GEbOQPgES1-wXpYg,ETV Dhee,"Dhee is a popular Indian dance reality show, commonly referred to as one of the biggest dance shows ever produced in South Indian television history. This show has never failed to entertain its audience since 2009 and still continues to amaze its fans even more with wonderful dance choreographies; intense dance battles; and unlimited entertainment.",https://yt3.ggpht.com/ytc/AIdro_lIlnwDbpINmTqElMJweOEXNyCLRgNV7qHKOc4qPAXEhEg=s88-c-k-c0x00ffffff-no-rj,UUoY_p16GEbOQPgES1-wXpYg,0,2026-06-07 01:49:25.211812+00,2026-06-07 01:49:25.211812+00
UCp0hYYBW6IMayGgR-WeoCvQ,TheEllenShow,"The place for laughs, joy, stars, surprises, and everything Ellen.",https://yt3.ggpht.com/n6BksIXpbZfRmlxqgdhTGVLvQVDtajIo1a8mxFDADhwE4wMUOhjnZ9qsRVPoTa9dfHnW1Yn9=s88-c-k-c0x00ffffff-no-rj,UUp0hYYBW6IMayGgR-WeoCvQ,0,2026-06-07 01:49:25.211812+00,2026-06-07 01:49:25.211812+00
UCP5tjEmvPItGyLhmjdwP7Ww,RealLifeLore,"Answers to questions that you've never asked. Welcome to the RealLifeLore community

Please  and ring the bell

Business Email: reallifelore@standard.tv

RealLifeLore on Spotify: spoti.fi/47yMfzp
RealLifeLore on Facebook:",https://yt3.ggpht.com/ytc/AIdro_lK3FQppzWeqpXhyk8SpqvzzlrKr-pqjpRtY3PUfeF9poY=s88-c-k-c0x00ffffff-no-rj,UUP5tjEmvPItGyLhmjdwP7Ww,0,2026-06-07 01:49:25.211812+00,2026-06-07 01:49:25.211812+00
UCP7jMXSY2xbc3KCAE0MHQ-A,Google DeepMind,"We live in an exciting time when AI research and technology are delivering extraordinary advances. In the coming years, AI — and ultimately artificial general intelligence (AGI) — has the potential to drive one of the greatest transformations in history.

We’re a team of scientists, engineers, ethicists and more, working to build the next generation of AI systems safely and responsibly. By solving some of the hardest scientific and engineering challenges of our time, we’re working to create breakthrough technologies that could advance science, transform work, serve diverse communities — and improve billions of people’s lives.

Learn more about Google DeepMind:",https://yt3.ggpht.com/xofhdRNoyqgAB_YpJgAQeasGtE6gTEXpR2v1vyMmtqlRCmoEUIsTGJcavUORLhhKQk3b9UeUFw=s88-c-k-c0x00ffffff-no-rj,UUP7jMXSY2xbc3KCAE0MHQ-A,0,2026-06-07 01:49:25.211812+00,2026-06-07 01:49:25.211812+00
UCPc_JsU4vg6agpjzWOefDxQ,Bubududu Misha,"Hello frnds! The purpose of making a video on Bubu   and Dudu is to bring fun into your  lives u can see here naughty couple , romantic , funny videos
*FOR BUSINESS INQUIRIES*👇
rajadanish0183@gmail.com",https://yt3.ggpht.com/ia1tFX3W7CcyvN0_BvGi-KG0Qs50_1wPT2CxtXtuwDbpVWRHBaGqK-et2ewEoAOdsurJS-ceow=s88-c-k-c0x00ffffff-no-rj,UUPc_JsU4vg6agpjzWOefDxQ,0,2026-06-07 01:49:25.211812+00,2026-06-07 01:49:25.211812+00
UCpjDFtZdjDuAzE0H-c2rxoQ,Elvis and Khaleesi,Just two bratty bulldogs who enjoy watching TV and mouthing off to our parents! Plz  to our channel and follow our adventures!,https://yt3.ggpht.com/ytc/AIdro_mz71Vv7P-M9kIeICZEzTvnLRZ8E2PhSOhOJx0nge90yW0=s88-c-k-c0x00ffffff-no-rj,UUpjDFtZdjDuAzE0H-c2rxoQ,0,2026-06-07 01:49:25.211812+00,2026-06-07 01:49:25.211812+00
UCpjTx5WsF4yqyvGIYY8nuVg,Vidit Gujrathi,I am Grandmaster Vidit Gujrathi. I am ranked 22nd in the World and 2nd in India. I mostly stream 10-15 times a month. I also like to make lighthearted Vlogs.,https://yt3.ggpht.com/ytc/AIdro_l666v73iXmmqRbSBif4VC80eZCn9_gRvvKWZH6mf5xCTM=s88-c-k-c0x00ffffff-no-rj,UUpjTx5WsF4yqyvGIYY8nuVg,0,2026-06-07 01:49:25.211812+00,2026-06-07 01:49:25.211812+00
UCPpVYvHuQSIkQwW1pJhfPrA,Jah Prayzah,Zimbabwean Artist and Frontman for 3G The Band. For Bookings email emushey@gmail.com,https://yt3.ggpht.com/Gz9DktJ0L2xM2MbbS6cnysL_H8yrHKoax7xEA-Ur17kceJoM5f-eqUTZnRXJz8Y1FzPE6ab6uw=s88-c-k-c0x00ffffff-no-rj,UUPpVYvHuQSIkQwW1pJhfPrA,0,2026-06-07 01:49:25.211812+00,2026-06-07 01:49:25.211812+00
UCPsqZ2T3Fq6dGm6l6AsGLVw,Anshuman IFS,"Anshuman Rajhans , IITD Passout
IFS 2018 AIR 11 
CSE 2018 AIR 356
This channel is dedicated for civil services preparation.
There are videos on Environment, Strategy for Preparation, Previous Year Discussion, Ethics Cass Studies.",https://yt3.ggpht.com/CvnjF7zgxoOjAaOQ5clxFROjGO9gOd_Z8qXZjRQ2mv9R6YMufOpzeEyD0mlEl2UTdb9CzpjUeA=s88-c-k-c0x00ffffff-no-rj,UUPsqZ2T3Fq6dGm6l6AsGLVw,0,2026-06-07 01:49:25.211812+00,2026-06-07 01:49:25.211812+00
UCpsSadsgX_Qk9i6i_bJoUwQ,Just For Laughs Gags,Welcome to the world-famous Just For Laughs Gags channel.  to our channel to stay up to date on our latest pranks!,https://yt3.ggpht.com/yECM7_PN1KQ_q_EYLZosSG4oOnVj0-Xb_qTrOFW1s15gtiCtlfRLPm_lGI2ZN9XqSCn7xDedDQ=s88-c-k-c0x00ffffff-no-rj,UUpsSadsgX_Qk9i6i_bJoUwQ,0,2026-06-07 01:49:25.211812+00,2026-06-07 01:49:25.211812+00
UCpVm7bg6pXKo1Pr6k5kxG9A,National Geographic,"Step into wonder and find your inner explorer with National Geographic. 

National Geographic is the world's premium destination for science, exploration, and adventure. Welcome to the National Geographic community, where we bring our stories, images and video to the world in real-time, inviting followers along on our ongoing 138-year journey. Our yellow border is a portal to the world, showcasing all of the wonder and beauty that it has to offer. This page allows our fans to join us while promoting an enriching and supportive climate for our community. Therefore, we do not tolerate words of hate, harassment or disparagement. We reserve the right to remove any posting or other material that we find off-topic, inappropriate or objectionable.",https://yt3.ggpht.com/-FOFg8o1y4dAHDB2MvhORHnLMOaaOKnaNUNsrU-U57Eac6gjB5VO8sYJQC1KkULGQvKP2XpArA=s88-c-k-c0x00ffffff-no-rj,UUpVm7bg6pXKo1Pr6k5kxG9A,0,2026-06-07 01:49:25.211812+00,2026-06-07 01:49:25.211812+00
UCpYeAw5P9b_8SIxRQtM1l-Q,Lexnos Gaming,Daily Clash of Clans Esports! USE CODE LEXNOS. Official Vatic Partner: Get Vatic Merch from: shop.vatic.gg,https://yt3.ggpht.com/XJV5G_kQ1Yz2oJBrtA4xr5ngQEE1NC8S1nYpEyDcE2VEQmFiZBGxeM0fvADI9jXuEWlw0dUjQGw=s88-c-k-c0x00ffffff-no-rj,UUpYeAw5P9b_8SIxRQtM1l-Q,0,2026-06-07 01:49:25.211812+00,2026-06-07 01:49:25.211812+00
UCPZz1TJIY69Q7fL5TOu2jWg,Ad Astra,#enisli     Stu-Stu-Stuttgart  🤟🏼,https://yt3.ggpht.com/G_2xAJTDy8qxunG1jmxgdXaKgjXta0kvWlqzV2wmM9kBr8Y_EuHlroY0AfC-kPP-rQWRWV9nJw=s88-c-k-c0x00ffffff-no-rj,UUPZz1TJIY69Q7fL5TOu2jWg,0,2026-06-07 01:49:25.211812+00,2026-06-07 01:49:25.211812+00
UCq0EGvLTyy-LLT1oUSO_0FQ,Eddie Woo,"I teach mathematics at a comprehensive public high school in Sydney, Australia. I'm also an author (Woo's Wonderful World of Maths, It's a Numberful World, Eddie Woo's Magical Maths 1 & 2, Whodunnit Eddie Woo?) and TV host (Ultimate Classroom on Channel 10, Teenage Boss on ABC ME).

I think learning is awesome, and love being able to share what I've learned with others!

More information about me and my work here:",https://yt3.ggpht.com/bZ3uv3RUbTTjRHzpsS-eqRhHeAeLTGwlxX30TkM0hTrXS9z55uSgW9kRZdgrrHvPxeUFxkxT=s88-c-k-c0x00ffffff-no-rj,UUq0EGvLTyy-LLT1oUSO_0FQ,0,2026-06-07 01:49:25.211812+00,2026-06-07 01:49:25.211812+00
UCq0imsn84ShAe9PBOFnoIrg,Brian Douglas,"Welcome to Control Systems Lectures!  This collection of videos is intended to supplement a first year controls class, not replace it.  My goal is to take specific concepts in controls and expand on them in order to provide an intuitive understanding which will ultimately make you a better controls engineer.  

I'm glad you made it to my channel and I hope you find it useful.

Shoot me a message at controlsystemlectures@gmail.com, leave a comment or question and I'll get back to you if I can. Don't forget to !
 
Twitter: @BrianBDouglas for engineering tweets and announcement of new videos.
Webpage: 

Here is the hardware/software I use: 

Here's a list of my favorite references: 

--Brian",https://yt3.ggpht.com/ytc/AIdro_nLo68wetImbwGUYP3stve_iKmAEccjhqB-q4o79xdInN4=s88-c-k-c0x00ffffff-no-rj,UUq0imsn84ShAe9PBOFnoIrg,0,2026-06-07 01:49:25.211812+00,2026-06-07 01:49:25.211812+00
UCqHNTfcDBADj-y62K6iKPWw,Katherine Uribe,,https://yt3.ggpht.com/ytc/AIdro_m7Vn-XTh5lfnSEQeOopKQ4x8DtrGktTCqrha6GzTexS-o=s88-c-k-c0x00ffffff-no-rj,UUqHNTfcDBADj-y62K6iKPWw,0,2026-06-07 01:49:25.211812+00,2026-06-07 01:49:25.211812+00
UCqOoboPm3uhY_YXhvhmL-WA,Discovery,"Dedicated to bringing our viewers amazing stories and experiences from the world of science, natural history, anthropology, survival, geography, and engineering.",https://yt3.ggpht.com/Bw8ru7-MHaynbpEL3Jb9w7h-FCHlO7J2n0F8DJRgxtyYItW3P9gThaupmOr0lbp4oFvJB-yN=s88-c-k-c0x00ffffff-no-rj,UUqOoboPm3uhY_YXhvhmL-WA,0,2026-06-07 01:49:25.211812+00,2026-06-07 01:49:25.211812+00
UCQwWUlTxR0bK3ceEzQf5lPw,Motki Bubu,"Join the adorable adventures of Bubu the bear and Dudu the panda as they spread happiness, kindness, and a little bit of magic in every episode! This channel is dedicated to cute, funny, and heartwarming short animations that will brighten your day.

Whether you're here to smile, relax, or just enjoy some wholesome moments — you're in the right place. Perfect for kids, teens, and adults who love kawaii content and peaceful vibes.

💫 Don’t forget to like, comment, and  for more Bubu Dudu love every week!",https://yt3.ggpht.com/qwJbqtZeeWQLQo6n_s4xRZ7WK7DDfDdMCeeMK2fbrQOAsSXKGNFfDc8OXjYjZE-kPzfdaYaA=s88-c-k-c0x00ffffff-no-rj,UUQwWUlTxR0bK3ceEzQf5lPw,0,2026-06-07 01:49:25.211812+00,2026-06-07 01:49:25.211812+00
UCQxOD2u81dZq_yseG5qMBPg,Alan Lands,"Zip code is where you can learn to code , then you will be employed for the rest of your life.

My channel is all about teaching you to code and the tips for coding, that may make you employed.

As you can see my channel published videos on coding, trust me I will help you.

If this sound something to you then make sure tho  this channel because you won't miss any tips.",https://yt3.ggpht.com/UwoUkG8V-LiqGoRymrTIgulUn4XRq3_cL5R1OWPA9prjAKMccMyjGabnStxYeY9PEJYnanVy6A=s88-c-k-c0x00ffffff-no-rj,UUQxOD2u81dZq_yseG5qMBPg,0,2026-06-07 01:49:25.211812+00,2026-06-07 01:49:25.211812+00
UCQYMhOMi_Cdj1CEAU-fv80A,Neso Academy,"#RedefiningEducation

Embarking on a mission to make education accessible, we strive to offer free and subsidized learning opportunities. Our belief resonates with the notion that the true world of knowledge extends beyond the confines of expensive institutions. Dedicated to supporting you in every conceivable way, we take a small but impactful step towards educating the world. Together, let's redefine education and empower individuals on their educational odyssey. Join us and become an integral part of our creative community.

Explore our diverse offerings:
 ► Engineering Lectures
 ► Competitive Exam Preparation

""Everyone is unique and talented; all you require are passion and curiosity.""

~WE'RE HIRING~


~DOWNLOAD THE APP~


For enquiries:  nesoacademy@gmail.com",https://yt3.ggpht.com/1iRrlRhV7RMLlyeLSeYaHjtvql01jATABgZtWeX3GyFcJJNNYp3ICYPgdyUOE6U4Y4PLXee594Q=s88-c-k-c0x00ffffff-no-rj,UUQYMhOMi_Cdj1CEAU-fv80A,0,2026-06-07 01:49:25.211812+00,2026-06-07 01:49:25.211812+00
UCqZQJ4600a9wIfMPbYc60OQ,Sabin Civil Engineering,"Sabin Civil Engineering  was founded by Sabin Mathew, an IIT Delhi post graduate in 2012. Here we aim to present various civil engineering topics in a simple way with the help of experiments and clear illustrations. Our videos are designed to clear misconceptions and create a passion for engineering.

This channel is currently in the brink of a shutdown. Your support at Patreon is valuable to us : 
Cheers Sabin Mathew",https://yt3.ggpht.com/uI3J9rcN5QvBD5rPMj5SaDUp41PIvTergbOWIKam39L7xxpzBT99zqcMiLrJ0qXalORqg0hKjA=s88-c-k-c0x00ffffff-no-rj,UUqZQJ4600a9wIfMPbYc60OQ,0,2026-06-07 01:49:25.211812+00,2026-06-07 01:49:25.211812+00
UCRaqrYgbZAdqCl-_tpG150Q,Royal Society of Chemistry,"We work at the heart of the chemical sciences community to create a future that is more open, more green, and more equal. 

Together, we’re helping chemistry to change the world. We connect people and ideas through partnerships, conferences, events and networks that span the globe. 

We publish scientists’ discoveries and insights so they can be used to improve our health, environment and lifestyles. 

We care about protecting our natural environment, about tackling discrimination to build a truly inclusive world, and about making cutting-edge chemistry accessible wherever it’s needed for the good of society. 

It’s all built upon and lifted up by our diverse global membership, with every one of those 60,000 members bringing a unique and valuable perspective.",https://yt3.ggpht.com/Lkx7xOrbdQ2XLeLvSZ0-uJVw7pUgGfB9HZGtQc_fxNY646kHUMXwodSx0TYa_fKYmLRQ1Ng6NAE=s88-c-k-c0x00ffffff-no-rj,UURaqrYgbZAdqCl-_tpG150Q,0,2026-06-07 01:49:25.211812+00,2026-06-07 01:49:25.211812+00
UCrdt0afUIkvx_afZV4CUiHg,milperthusky,"Millie and Ruperts new official page. 

Follow our journey everyone.",https://yt3.ggpht.com/ytc/AIdro_loiNuHb36AFpU-sTP7us9mir1hCfY1QxbB_DIg49zcj6w=s88-c-k-c0x00ffffff-no-rj,UUrdt0afUIkvx_afZV4CUiHg,0,2026-06-07 01:49:25.211812+00,2026-06-07 01:49:25.211812+00
UCrEpcytjAHOGhvICHJo4ziw,Vidya Deshpande - Saptami,,https://yt3.ggpht.com/fmDc3YQ2KDsFAnEWjAJ6VstzUyUcDNSF9_-Gmg9YnzFQPpgMM48Jm0dY_bXXA9iaIwzEUGtpAAY=s88-c-k-c0x00ffffff-no-rj,UUrEpcytjAHOGhvICHJo4ziw,0,2026-06-07 01:49:25.211812+00,2026-06-07 01:49:25.211812+00
UCRk6f7EPdMWB_dQNi2Ga-1A,JimKurose,,https://yt3.ggpht.com/ytc/AIdro_kxb902Tgpj_gYF4rSrsTz8ShEEq_YspgJL5Aa5ZcY=s88-c-k-c0x00ffffff-no-rj,UURk6f7EPdMWB_dQNi2Ga-1A,0,2026-06-07 01:49:25.211812+00,2026-06-07 01:49:25.211812+00
UCRKfUaJ9YZnepmhrXU8bOgA,Beatriz Solis Official,Bookings : beatrizsolisofficial@gmail.com,https://yt3.ggpht.com/63FRhDvWz-DD_UxlpmBuTI2V9Kbb-sWcAPAy8ktZmFlq44qilZtJnyHPiaAOtCkpaQQjxtIeqg=s88-c-k-c0x00ffffff-no-rj,UURKfUaJ9YZnepmhrXU8bOgA,0,2026-06-07 01:49:25.211812+00,2026-06-07 01:49:25.211812+00
